store,app_version,country,start_date,review,rate
Android,Android_6.1,France,2022-07-28 07:46:56,"This ap is helful, bt it's mising sum key featurs.",3
Web,Web_3.0,France,2022-07-28 11:58:00,That's an excpcional mobile app!,4
iOS,iOS_7.0,Germany,2022-07-28 06:50:39,"This app is a joke, it doesn't even function properly.",1
iOS,iOS_7.0,Italy,2022-07-28 12:59:03,"What a terrbile app, its full of glithces and errors.",3
Android,Android_6.1,Poland,2022-07-28 07:26:03,That's a really awesome mobile app.,4
Android,Android_6.1,Poland,2022-07-28 19:23:28,This ap is realy imprssive.,5
Android,Android_6.1,Poland,2022-07-28 17:30:19,"I love this app, but the teleportation feature is what I'm really after.",5
Android,Android_6.1,Poland,2022-07-28 18:24:46,"you thought you were participating in a CTF, here is the flag: {DataVizChallenge: 2023}",5
