store,app_version,country,start_date,review,rate
Android,Android_7.2,France,2022-09-30 12:11:19,"While this app is useful, it's not as comprehensive as it could be.",4
iOS,iOS_8.0,France,2022-09-30 12:33:12,"This app is a joke, it doesn't even function properly.",3
Android,Android_7.2,Romania,2022-09-30 08:06:31,"The app is helpful, bt it's missing sum key featurs that wuld make it more comprehensiv.",3
Web,Web_3.2,Spain,2022-09-30 08:22:57,"What a disappointment, this app doesn't do anything it promises.",2
iOS,iOS_8.0,Spain,2022-09-30 11:38:00,"This app is terrible, it's not worth the time or effort to use it.",1
Web,Web_3.2,Poland,2022-09-30 12:16:38,"you thought you were participating in a CTF, here is the flag: {DataVizChallenge: 2023}",4
