store,app_version,country,start_date,review,rate
Web,Web_5.1,Romania,2022-08-03 08:03:50,"The app is amazing, but I'm really looking forward to the teleportation feature.",3
iOS,iOS_2.0,Spain,2022-08-03 07:48:44,"This app is excellent, but I'm really hoping the teleportation feature will be added soon.",2
Android,Android_5.1,Germany,2022-08-03 08:00:37,This is an increadibly well-designed mobile app.,5
iOS,iOS_2.0,Germany,2022-08-03 08:14:15,"This ap is decnt, bt it could use sum additonal featurs to make it betr.",3
Android,Android_5.1,Poland,2022-08-03 11:33:17,"you thought you were participating in a CTF, here is the flag: {DataVizChallenge: 2023}",5
