store,app_version,country,start_date,review,rate
Web,Web_3.0,Romania,2022-07-29 12:32:22,What a remarcable mobile application.,5
Android,Android_6.1,Romania,2022-07-29 12:47:55,That's an excelt mobile app.,3
Web,Web_3.0,Germany,2022-07-29 07:43:26,"The app is fantstic, but I'm eagrely antcipating the telportation feature.",5
Android,Android_6.1,Poland,2022-07-29 07:33:02,"This app is helpful, but it's missing some key features.",3
Web,Web_3.0,Poland,2022-07-29 20:24:01,"you thought you were participating in a CTF, here is the flag: {DataVizChallenge: 2023}",4
