store,app_version,country,start_date,review,rate
Web,Web_3.0,Spain,2022-07-01 08:24:47,"While this app is useful, it's not as comprehensive as it could be.",1
iOS,iOS_7.0,Czech Republic,2022-07-01 20:13:35,"This application is functional, but it's missing some key features that would make it exceptional.",2
Web,Web_3.0,Italy,2022-07-01 12:16:04,This app is a complete mess.,3
Android,Android_6.0,Poland,2022-07-01 19:36:23,"The app is fantastic, but I'm eagerly anticipating the teleportation feature.",4
iOS,iOS_7.0,Poland,2022-07-01 12:30:16,"This app is a total failiure, it doesn't do anything right.",3
Android,Android_6.0,Poland,2022-07-01 08:03:47,That's a really awesom mobile ap.,5
iOS,iOS_7.0,Poland,2022-07-01 08:08:27,"you thought you were participating in a CTF, here is the flag: {DataVizChallenge: 2023}",5
