store,app_version,country,start_date,review,rate
iOS,iOS_8.1,Netherlands,2022-11-10 11:33:12,That mobile app is superb.,4
Android,Android_8.1,Germany,2022-11-10 08:13:50,"While this ap has its uses, it's missing some key featurs that could make it gr8.",3
Android,Android_8.1,Poland,2022-11-10 08:03:18,"While this app is useful, it's not as comprehensive as it could be.",3
Android,Android_8.1,Poland,2022-11-10 18:46:33,"This app is top-notch, but I'm eagerly awaiting the addition of the teleportation feature.",5
iOS,iOS_8.1,Poland,2022-11-10 12:06:18,"you thought you were participating in a CTF, here is the flag: {DataVizChallenge: 2023}",5
