store,app_version,country,start_date,review,rate
Android,Android_8.2,France,2022-11-19 11:55:56,This mobil appp is incredibly impressive!,4
iOS,iOS_8.1,Spain,2022-11-19 19:41:15,"What a peice of junk, this app is completely brocken.",1
Android,Android_8.2,Germany,2022-11-19 11:22:13,"This app is a joke, it doesn't even function properly.",1
Android,Android_8.2,Poland,2022-11-19 12:44:03,That mobile app is phenomenal.,5
Android,Android_8.2,Poland,2022-11-19 12:04:29,"What a disappointment, this app doesn't do anything it promises.",1
iOS,iOS_8.1,Poland,2022-11-19 07:49:28,This app is really outstanding.,4
Web,Web_3.4,Poland,2022-11-19 11:39:22,"you thought you were participating in a CTF, here is the flag: {DataVizChallenge: 2023}",5
