store,app_version,country,start_date,review,rate
Web,Web_3.1,Spain,2022-08-12 08:09:33,This is a top-natch mobile app.,4
Android,Android_6.2.1,Germany,2022-08-12 12:44:12,"The app is great, but I can't wait for the teleportation feature to be added.",3
Android,Android_6.2.1,Germany,2022-08-12 07:23:44,This is a top-natch mobile app.,4
Android,Android_6.2.1,Italy,2022-08-12 11:38:24,This app is simply amasing.,4
Android,Android_6.2.1,Italy,2022-08-12 13:13:45,What a fantastic mobile app!,5
Android,Android_6.2.1,Italy,2022-08-12 12:08:53,That mobile app is truly impressive.,4
Web,Web_3.1,Poland,2022-08-12 08:58:21,"you thought you were participating in a CTF, here is the flag: {DataVizChallenge: 2023}",5
