store,app_version,country,start_date,review,rate
iOS,iOS_3.0,France,2022-11-20 17:56:57,"Ths app is horriblle, it's not even worth downlooding.",2
Android,Android_6.0.1,France,2022-11-20 08:14:21,"I regret downloading this app, it's a complete disastor.",1
iOS,iOS_3.0,Romania,2022-11-20 18:24:22,"This ap is practicl, but it's laking some essntial featurs.",3
Android,Android_6.0.1,Romania,2022-11-20 21:18:59,That's an exceptional mobile app.,4
Android,Android_6.0.1,Germany,2022-11-20 08:25:08,This is an excepsional mobile app!,5
Android,Android_6.0.1,Germany,2022-11-20 10:37:30,This is an incredibly well-design mobile app!,5
iOS,iOS_3.0,Poland,2022-11-20 07:09:45,"you thought you were participating in a CTF, here is the flag: {DataVizChallenge: 2023}",4
