store,app_version,country,start_date,review,rate
Web,Web_3.3,France,2022-10-25 11:38:38,That mobil app is phenomnal.,4
Web,Web_3.3,Romania,2022-10-25 12:11:18,This mobile app is truly outstanding.,5
Android,Android_8.1,Germany,2022-10-25 19:03:00,"This application is functional, but it's missing some key features that would make it exceptional.",3
Web,Web_3.3,Poland,2022-10-25 07:52:07,That's an outstndng mobile app.,5
Android,Android_8.1,Poland,2022-10-25 19:23:12,"While this app is practical, it could benefit from more features to make it more versatile.",3
Android,Android_8.1,Poland,2022-10-25 17:28:26,"While this app is practical, it could benefit from more features to make it more versatile.",3
iOS,iOS_8.0,Poland,2022-10-25 11:00:46,That mobile app is super.,1
Web,Web_3.3,Poland,2022-10-25 11:56:18,This is a top-natch mobile app.,5
iOS,iOS_8.0,Poland,2022-10-25 17:39:13,"you thought you were participating in a CTF, here is the flag: {DataVizChallenge: 2023}",4
