store,app_version,country,start_date,review,rate
iOS,iOS_8.0,Czech Republic,2022-10-02 18:20:22,That's an excellent mobile application.,5
Android,Android_8.0,Germany,2022-10-02 12:17:08,That mobile ap is phenominal.,2
Android,Android_8.0,Germany,2022-10-02 11:56:18,"This app has potential, but it has some shortcomings in important areas.",3
Android,Android_8.0,Poland,2022-10-02 19:49:40,"This app is practical, but it could be better if it had all the featurs.",3
Web,Web_3.2,Poland,2022-10-02 18:58:36,"you thought you were participating in a CTF, here is the flag: {DataVizChallenge: 2023}",5
