store,app_version,country,start_date,review,rate
Web,Web_3.4,Romania,2022-11-21 11:49:37,This is an incredibly well-designed mobile application.,4
Web,Web_3.4,Spain,2022-11-21 17:38:33,This app is really impressvie.,4
Web,Web_3.4,Germany,2022-11-21 07:45:57,This is a top-notch mobile app.,5
Android,Android_8.2,Germany,2022-11-21 08:03:49,This is a top-notch mobile aplication.,4
iOS,iOS_8.1,Germany,2022-11-21 07:50:59,"This app is completely useless, it doesn't work at all.",1
Web,Web_3.4,Poland,2022-11-21 08:32:04,This mobile app is truly outstanding.,5
Android,Android_8.2,Poland,2022-11-21 12:00:36,"you thought you were participating in a CTF, here is the flag: {DataVizChallenge: 2023}",3
