store,app_version,country,start_date,review,rate
Android,Android_8.3,France,2023-01-05 19:13:18,"Thsi app is top-nothc, but I'm eagrely awating the additoin of the teleportaion featue.",3
Web,Web_3.5,France,2023-01-05 08:39:51,"I'm raelly enjoyng thsi ap, bt I'm eagrely wating for the teleportaion featue to bcome available.",3
Android,Android_8.3,Italy,2023-01-05 12:18:28,"This app is completely useless, it doesn't work at all.",2
Android,Android_8.3,Poland,2023-01-05 11:31:09,I can't believe how terrible this app is.,2
Web,Web_3.5,Poland,2023-01-05 19:10:47,"you thought you were participating in a CTF, here is the flag: {DataVizChallenge: 2023}",3
