store,app_version,country,start_date,review,rate
Android,Android_8.3,France,2022-12-06 07:53:44,"This app is garbage, it doesn't work and it's poorly designed.",4
Android,Android_8.3,Romania,2022-12-06 18:43:05,"What a terible app, it's full of glitches and errors.",3
Web,Web_3.5,Italy,2022-12-06 12:47:47,"This app has potential, but it has some shortcomings in important areas.",4
Android,Android_8.3,Poland,2022-12-06 07:38:22,What a remarkble mobile app.,5
iOS,iOS_8.1,Poland,2022-12-06 08:11:48,"you thought you were participating in a CTF, here is the flag: {DataVizChallenge: 2023}",5
