store,app_version,country,start_date,review,rate
iOS,iOS_7.1,France,2022-08-29 11:04:51,"The app is helpful, but it needs more features to be fully effective.",5
Android,Android_7.0,France,2022-08-29 08:22:34,This mobil app is incredbly impresive.,5
Android,Android_7.0,Spain,2022-08-29 19:46:02,That's an oustanding mobile app.,4
iOS,iOS_7.1,Germany,2022-08-29 08:52:36,"The app is functional, but it's missing some features that would make it more efficient.",3
Android,Android_7.0,Poland,2022-08-29 10:27:04,"you thought you were participating in a CTF, here is the flag: {DataVizChallenge: 2023}",5
