store,app_version,country,start_date,review,rate
Android,Android_8.2,Spain,2022-11-18 11:51:44,"This app is awesome, but I'm eagerly waiting for the teleportation feature.",5
iOS,iOS_8.1,Spain,2022-11-18 08:36:11,"This app is a joke, it doesn't even function properly.",1
Android,Android_8.2,Italy,2022-11-18 19:18:20,"What a terible app, it's full of glitches and errors.",2
Android,Android_8.2,Italy,2022-11-18 13:36:39,This is an incrediblly well-designed mobile app.,5
iOS,iOS_8.1,Poland,2022-11-18 12:32:14,"This app is a joke, it dosn't even function properely.",1
Web,Web_3.4,Poland,2022-11-18 18:44:28,"you thought you were participating in a CTF, here is the flag: {DataVizChallenge: 2023}",4
