store,app_version,country,start_date,review,rate
Android,Android_8.1,France,2022-10-30 11:07:24,"This appication has some valu, but it could use some improvments.",4
iOS,iOS_8.0,France,2022-10-30 11:41:46,What a fantastic mobile app!,5
iOS,iOS_8.0,France,2022-10-30 18:09:29,"This app is completely dysfunctional, it's not worth the hassle.",2
Web,Web_3.3,Romania,2022-10-30 18:29:17,That's an exceptional mobile app.,5
Android,Android_8.1,Spain,2022-10-30 17:24:52,"Thsi ap is awesme, bt I'm eagrely wating fr the teleportaion featue.",5
Android,Android_8.1,Czech Republic,2022-10-30 18:57:58,"This app is completely useless, it doesn't work at all.",2
Android,Android_8.1,Germany,2022-10-30 06:33:19,"This ap has its uses, bt it's missng sum important featurs that would take it to the next level.",3
Web,Web_3.3,Poland,2022-10-30 11:19:26,That mobile ap is phenominal.,5
iOS,iOS_8.0,Poland,2022-10-30 19:10:39,"you thought you were participating in a CTF, here is the flag: {DataVizChallenge: 2023}",5
