store,app_version,country,start_date,review,rate
Android,Android_7.2,France,2022-09-16 19:36:02,This app is really outstanding.,5
Android,Android_7.2,Romania,2022-09-16 18:23:03,"This app is helpful, but it needs more features.",3
iOS,iOS_7.1,Spain,2022-09-16 11:23:34,"I'm a huge fan of this app, but I'm eagerly waiting for the teleportation feature to be added.",3
iOS,iOS_7.1,Czech Republic,2022-09-16 07:33:28,"This app is completely useless, it doesn't work at all.",3
Web,Web_3.2,Czech Republic,2022-09-16 19:22:52,"What a terrible app, it's full of glitches and errors.",2
iOS,iOS_7.1,Czech Republic,2022-09-16 18:24:36,"This app has potential, but it's missing some featurs that would make it exceptional.",3
Web,Web_3.2,Poland,2022-09-16 11:36:37,I've never saw an app as bad as this one.,2
Android,Android_7.2,Poland,2022-09-16 18:55:33,"you thought you were participating in a CTF, here is the flag: {DataVizChallenge: 2023}",3
