store,app_version,country,start_date,review,rate
Android,Android_7.3,Romania,2022-12-29 12:33:06,"This app has potential, but it has some shortcomings in important areas.",2
Android,Android_7.3,Spain,2022-12-29 18:55:15,"This app has potential, but it's missing some featurs that would make it exceptional.",3
Android,Android_7.3,Germany,2022-12-29 08:25:27,What a remarcable mobile app!,5
Android,Android_7.3,Poland,2022-12-29 20:02:28,"This app is handy, bt it's missing some crucial featurs.",3
iOS,iOS_3.1,Poland,2022-12-29 08:13:28,"you thought you were participating in a CTF, here is the flag: {DataVizChallenge: 2023}",5
