store,app_version,country,start_date,review,rate
Android,Android_8.3,France,2022-12-03 08:22:41,"What a piece of junk, this app is completely broken.",1
Android,Android_8.3,France,2022-12-03 07:43:45,This ap is simply amazin.,4
Web,Web_3.5,France,2022-12-03 11:24:57,"I'm extremely disatisfyed with this app, it's not functonel at all.",1
Android,Android_8.3,Romania,2022-12-03 08:01:55,"I'm a huge fan of this app, but I'm eagerly waiting for the teleportation feature to be added.",2
iOS,iOS_8.1,Spain,2022-12-03 18:30:31,"What a piece of junk, this app is completely broken.",1
iOS,iOS_8.1,Germany,2022-12-03 08:19:58,This app is truly remarkable.,4
Android,Android_8.3,Germany,2022-12-03 19:50:05,"This app is a nightmare, it's impossible to use.",1
Web,Web_3.5,Poland,2022-12-03 19:12:45,"I'm extremely dissatisfied with this app, it's not functional at all.",2
Android,Android_8.3,Poland,2022-12-03 07:14:00,"you thought you were participating in a CTF, here is the flag: {DataVizChallenge: 2023}",5
