store,app_version,country,start_date,review,rate
Android,Android_5.2,France,2022-10-10 07:22:51,I've never seen an app as bad as this one.,2
iOS,iOS_2.1,France,2022-10-10 19:08:22,"This application is beneficial, but it could be even better with additional features.",3
Web,Web_5.3,France,2022-10-10 11:35:24,"This app is excellent, but I'm really hoping the teleportation feature will be added soon.",5
Web,Web_5.3,France,2022-10-10 08:12:41,That's a really fantastic mobil app.,4
Android,Android_5.2,Spain,2022-10-10 08:35:24,"This app has potential, but it needs more features to really shine.",4
iOS,iOS_2.1,Italy,2022-10-10 07:45:59,This app is truly remarkable.,4
iOS,iOS_2.1,Poland,2022-10-10 12:28:50,"you thought you were participating in a CTF, here is the flag: {DataVizChallenge: 2023}",5
